LOs,Sub-Topic,Topic,Subject,Type,Module,Assessment
"Describe Epidemiology of Iron Deficiency Anemia.
Describe prevention of different types of anemia’s in community.","Epidemiology of bone diseases ",Anemias,Community Medicine,Minor Subject,Blood-1 Module,MCQS
"Classify white blood cells.
Describe the structure, function, life span and normal count of White Blood Cells.
Describe the stages of differentiation of white blood cells (leukopoiesis).
Describe the general characteristics of
leucocytes.
Define granulocytes and agranulocytes.",White blood cells,Infection and Immunity,Physiology,Major Subject,Blood-1 Module,MCQS
Explain the steps involved in mechanism of action of neutrophils and monocytes against infection.,"Neutrophils and Monocytes’ role in infection ",Infection and Immunity,Physiology,Major Subject,Blood-1 Module,MCQS
"Explain leukocytosis.
Discuss pathophysiology of leukemias.",Leukocytosis,Infection and Immunity,Physiology,Major Subject,Blood-1 Module,MCQS
Perform the steps to determine the normal TLC count in blood sample by Neubauer chamber,"WBC Count ",Infection and Immunity,Physiology,Major Subject,Blood-1 Module,OSPE
"Perform the steps to determine the normal DLC count in blood sample by Neubauer chamber.
Identify different blood cells in a film and indicate the identifying features of each type of leucocyte.
Express results in their percentages and absolute numbers","DLC Count ",Infection and Immunity,Physiology,Major Subject,Blood-1 Module,OSPE
"Enlist the components of Reticuloendothelial system. Describe the functions of Reticuloendothelial system.
Describe the role of monocyte-macrophage system in immunity.
Explain the role of neutrophils, macrophages, basophils, eosinophils and monocytes in providing immunity against infections (immune system).",Reticuloendothelial System,Infection and Immunity,Physiology,Major Subject,Blood-1 Module,MCQS
"Define inflammation.
Describe characteristics of inflammation (hallmark of inflammation).
Describe the causes, sequence of events and cardinal signs of inflammation.",Inflammation,Infection and Immunity,Physiology,Major Subject,Blood-1 Module,MCQS
"Describe the functions of immune system. Describe the structure and function of lymphatic system.
Classify cells of immune system with respect to their origin.
Enlist the innate defenses.
Describe the basic types of Acquired immunity: Humoral and Cell mediated.
Compare the characteristics of innate and acquired immunity.
Compare the active and passive immunity mechanism.","Immunity ",Infection and Immunity,Physiology,Major Subject,Blood-1 Module,MCQS
"Enumerate the major lymphoid organs. Describe the location and Anatomy of major lymphoid organs in relation to their function.
Describe the components of lymphoid tissue and a lymphoid nodule.
Discuss the MALT, GALT and their role in immunity. Describe the histological features of thymus
Discuss the role of thymus in terminal differentiation and selection of T lymphocytes.",Histology of Lymphoid Tissues-1,Infection and Immunity,Histology,Major Subject,Blood-1 Module,MCQS
"Discuss the role of lymph node in facilitating the interaction of afferent lymph and lymphocytes.
Describe the histological features of spleen and the role of spleen in facilitating intimate contact between blood and lymphocytes.
Describe the histological features of tonsil.",Histology of Lymphoid Tissues-2,Infection and Immunity,Histology,Major Subject,Blood-1 Module,MCQS
"Identify lymphatic nodule in lymph
node. Identify thymic lobule.
Histological Diagram of Lymph Node and Thymus.",Lymphoid System-1,Infection and Immunity,Histology,Major Subject,Blood-1 Module,OSPE
"Identify lymphatic nodule in Spleen and Palatine Tonsil.
Identify Red and White Pulp in Spleen.
Histological Diagram of Palatine Tonsil and Spleen.",Lymphoid System-2,Infection and Immunity,Histology,Major Subject,Blood-1 Module,OSPE
"Describe the role of lymphocytes in development of immunity.
Describe the role of Helper T-cells in overall regulation of immunity.
Explain the mechanism of action of cytotoxic T cells.
Explain mechanism of action of suppressor T-cells.",Role of Lymphocytes in Immunity-1,Infection and Immunity,Physiology,Major Subject,Blood-1 Module,MCQS
"Describe the specific contribution of B lymphocytes in humoral immunity and antibody formation.
Differentiate between humoral and cell mediated immunity.",Role of Lymphocytes in Immunity-2,Infection and Immunity,Physiology,Major Subject,Blood-1 Module,MCQS
"Explain the functions of complement system.
Explain how the complement system elicits the inflammatory response, lyses foreign cells, and increases phagocytosis.
Discuss, draw and compare classical and alternate pathways.","Complement System ",Infection and Immunity,Physiology,Major Subject,Blood-1 Module,MCQS
Describe pathophysiology of autoimmune diseases.,"Autoimmune diseases ",Infection and Immunity,Physiology,Major Subject,Blood-1 Module,MCQS
"Discuss the pathophysiology of allergies.
Define and classify the hypersensitivity reaction. Compare the immediate and delayed hypersensitivity reactions. List the diseases associated with hypersensitivity reactions.",Allergy and Hypersensitivity reactions,Infection and Immunity,Physiology,Major Subject,Blood-1 Module,MCQS
"Define Immunoglobulins. Describe Types of Immunoglobulins.
Describe Structure of Immunoglobulins.","Immunoglobulins ",Infection and Immunity,Biochemistry,Major Subject,Blood-1 Module,MCQS
"Describe the mechanism of action of antibodies.
Explain Biochemical role of each immunoglobulin in immunity.",Immunoglobulin Antibodies,Infection and Immunity,Biochemistry,Major Subject,Blood-1 Module,MCQS
"Illustrate sources, chemistry and mechanism of action of vitamin Cobalamin and their Biochemical functions in body.
Define Disorders associated with vitamin Cobalamin deficiency and hypervitaminoses.",Vitamin Cobalamin,Infection and Immunity,Biochemistry,Major Subject,Blood-1 Module,MCQS
"Illustrate sources, chemistry and mechanism of action of vitamin folic acid and their Biochemical functions in body.
Define Disorders associated with vitamin folic acid deficiency and hypervitaminoses.",Vitamin Folic Acid,Infection and Immunity,Biochemistry,Major Subject,Blood-1 Module,MCQS
"Define vaccine and immunization.
Explain the expanded program of immunization (EPI) in Pakistan.",Vaccinology,Infection and Immunity,Community Medicine,Minor Subject,Blood-1 Module,MCQS
"Describe the structure, function, life span and normal count of Platelets. Describe the sequence of events involved in hemostasis.
Describe the role of platelet in coagulation.",Hemostasis,Bleeding Disorders and Transfusion Reactions,Physiology,Major Subject,Blood-1 Module,MCQS
"Perform the steps to determine the
normal Platelet count in the blood sample by Neubauer chamber.",Platelet Count,Bleeding Disorders and Transfusion Reactions,Physiology,Major Subject,Blood-1 Module,MCQS
"Enlist the clotting factors of the body.
Outline the sequence of processes during blood coagulation.
Explain the intrinsic pathways of clotting.",Blood coagulation mechanisms -1,Bleeding Disorders and Transfusion Reactions,Physiology,Major Subject,Blood-1 Module,MCQS
Explain the extrinsic pathways of clotting. Describe the factors involved in preventing clotting of blood under normal homeostatic condition. Explain the mechanism of clot dissolution.,Blood coagulation mechanisms-2,Bleeding Disorders and Transfusion Reactions,Physiology,Major Subject,Blood-1 Module,MCQS
Discuss pathophysiology of hemophilia. Describe the abnormalities of clotting factors in Hemophilia.,"Thromboembolic diseases and Bleeding disorders ",Bleeding Disorders and Transfusion Reactions,Physiology,Major Subject,Blood-1 Module,MCQS
"Perform the steps to determine the BT and CT in blood sample.
Indicate the clinical importance of doing BT and CT.",Bleeding time and Clotting time,Bleeding Disorders and Transfusion Reactions,Physiology,Major Subject,Blood-1 Module,OSPE
"Define agglutinin and agglutinogen.
Describe the role of agglutinin and agglutinogen in blood grouping.
Describe different types of blood groups. Describe the physiological basis of ABO blood grouping.",Blood groups-1,Bleeding Disorders and Transfusion Reactions,Physiology,Major Subject,Blood-1 Module,MCQS
"Interpret the plausible blood
groups (A-B-O) in children of parents with known blood groups.
Interpret the types of agglutinins present in individuals with a specific blood group.
Describe the physiological basis of Rh blood grouping.",Blood groups-2,Bleeding Disorders and Transfusion Reactions,Physiology,Major Subject,Blood-1 Module,MCQS
"Describe the mechanism involved in transfusion reaction.
Explain universal donor and universal recipient blood groups.
Enlist the manifestations of transfusion reaction.
Discuss erythroblastosis fetalis.",Transfusion reactions and Erythroblastosis fatalis,Bleeding Disorders and Transfusion Reactions,Physiology,Major Subject,Blood-1 Module,MCQS
"Perform, the steps to identify ABO and Rh typing of a given blood sample.",Blood groups,Bleeding Disorders and Transfusion Reactions,Physiology,Major Subject,Blood-1 Module,OSPE
"Classify plasma proteins.
Enumerate functions of plasma proteins.",Plasma proteins,Bleeding Disorders and Transfusion Reactions,Biochemistry,Major Subject,Blood-1 Module,MCQS
"Identify the site of action of following drugs in coagulation cascade:
Heparin
Warfarin
Rivaroxaban","Coagulation cascade drugs relevant to intrinsic and
extrinsic pathway of
coagulation cascade",Bleeding Disorders and Transfusion Reactions,Pharmacology,Minor Subject,Blood-1 Module,MCQS
"Describe the Medicolegal importance of blood groups in forensic work that is
Personal Identity
Inheritance claims
DNA profiling
Disputed paternity and maternity",Medico-legal importance of Blood Groups,Bleeding Disorders and Transfusion Reactions,Forensic Medicine,Minor Subject,Blood-1 Module,MCQS
"Identify important blood borne pathogens and how they are spread.
Discuss the epidemiology of blood borne disease transmission and the potential for HIV, HBV and HCV transmission.
Identify routes of transmission of blood borne pathogens. Discuss the best practices to perform safe blood transfusion.
Identify potential exposure risks List important safeguards against blood borne pathogen diseases.",Epidemiology of Blood Borne Diseases,Bleeding Disorders and Transfusion Reactions,Community Medicine,Minor Subject,Blood-1 Module,MCQS